{
  "generated_at": "2026-10-13T10:15:56.115Z",
  "method": "assets/js/lifecycle-lib.js summarize() — stage-per-snapshot classification using the classifier's own thresholds (ignition line v=70, rise/fall ±1.5/hr)",
  "honesty": "Stages are readouts from recorded velocity snapshots, not predictions. Topics with fewer than 3 snapshots report 'building'. The ignitions/burnouts boards list stage transitions that actually happened in the last 24h.",
  "counts": {
    "peaking": 89,
    "steady": 144,
    "building": 160
  },
  "ignitions": [
    {
      "id": "epic-games-delays-disney-project-asks-developers-t",
      "title": "Epic Games Delays Disney Project, Asks Developers to Use More AI",
      "from": "igniting",
      "to": "peaking",
      "ts": "2026-10-13T03:58:16.636827+00:00"
    },
    {
      "id": "epic-games-delays-disney-project-asks-developers-t",
      "title": "Epic Games Delays Disney Project, Asks Developers to Use More AI",
      "from": "steady",
      "to": "igniting",
      "ts": "2026-10-13T02:34:06.091323+00:00"
    },
    {
      "id": "nurses-are-taking-on-tiktok-s-viral-health-myths-h",
      "title": "Nurses are taking on TikTok’s viral health myths — here’s how they’re fighting back",
      "from": "igniting",
      "to": "peaking",
      "ts": "2026-10-12T23:29:56.865132+00:00"
    },
    {
      "id": "nurses-are-taking-on-tiktok-s-viral-health-myths-h",
      "title": "Nurses are taking on TikTok’s viral health myths — here’s how they’re fighting back",
      "from": "steady",
      "to": "igniting",
      "ts": "2026-10-12T22:49:01.408645+00:00"
    }
  ],
  "burnouts": [],
  "topics": {
    "six-seven-meme": {
      "stage": "peaking",
      "since": "2026-10-11T23:47:16.629612+00:00",
      "ribbon": [
        "peaking",
        "peaking",
        "peaking",
        "peaking",
        "peaking",
        "peaking",
        "peaking",
        "peaking",
        "peaking",
        "peaking",
        "peaking",
        "peaking",
        "peaking",
        "peaking",
        "peaking",
        "peaking",
        "peaking",
        "peaking",
        "peaking",
        "peaking",
        "peaking"
      ]
    },
    "gta6-robberies": {
      "stage": "peaking",
      "since": "2026-10-11T23:47:16.629612+00:00",
      "ribbon": [
        "peaking",
        "peaking",
        "peaking",
        "peaking",
        "peaking",
        "peaking",
        "peaking",
        "peaking",
        "peaking",
        "peaking",
        "peaking",
        "peaking",
        "peaking",
        "peaking",
        "peaking",
        "peaking",
        "peaking",
        "peaking",
        "peaking",
        "peaking",
        "peaking"
      ]
    },
    "seis-sete-dance": {
      "stage": "peaking",
      "since": "2026-10-11T23:47:16.629612+00:00",
      "ribbon": [
        "peaking",
        "peaking",
        "peaking",
        "peaking",
        "peaking",
        "peaking",
        "peaking",
        "peaking",
        "peaking",
        "peaking",
        "peaking",
        "peaking",
        "peaking",
        "peaking",
        "peaking",
        "peaking",
        "peaking",
        "peaking",
        "peaking",
        "peaking",
        "peaking"
      ]
    },
    "trump-rally-nobel": {
      "stage": "peaking",
      "since": "2026-10-11T23:47:16.629612+00:00",
      "ribbon": [
        "peaking",
        "peaking",
        "peaking",
        "peaking",
        "peaking",
        "peaking",
        "peaking",
        "peaking",
        "peaking",
        "peaking",
        "peaking",
        "peaking",
        "peaking",
        "peaking",
        "peaking",
        "peaking",
        "peaking",
        "peaking",
        "peaking",
        "peaking",
        "peaking"
      ]
    },
    "houthi-riyadh-strike": {
      "stage": "peaking",
      "since": "2026-10-11T23:47:16.629612+00:00",
      "ribbon": [
        "peaking",
        "peaking",
        "peaking",
        "peaking",
        "peaking",
        "peaking",
        "peaking",
        "peaking",
        "peaking",
        "peaking",
        "peaking",
        "peaking",
        "peaking",
        "peaking",
        "peaking",
        "peaking",
        "peaking",
        "peaking",
        "peaking",
        "peaking",
        "peaking"
      ]
    },
    "nba-tiktok-surge": {
      "stage": "peaking",
      "since": "2026-10-11T23:47:16.629612+00:00",
      "ribbon": [
        "peaking",
        "peaking",
        "peaking",
        "peaking",
        "peaking",
        "peaking",
        "peaking",
        "peaking",
        "peaking",
        "peaking",
        "peaking",
        "peaking",
        "peaking",
        "peaking",
        "peaking",
        "peaking",
        "peaking",
        "peaking",
        "peaking",
        "peaking",
        "peaking"
      ]
    },
    "nana-patekar-tributes": {
      "stage": "peaking",
      "since": "2026-10-11T23:47:16.629612+00:00",
      "ribbon": [
        "peaking",
        "peaking",
        "peaking",
        "peaking",
        "peaking",
        "peaking",
        "peaking",
        "peaking",
        "peaking",
        "peaking",
        "peaking",
        "peaking",
        "peaking",
        "peaking",
        "peaking",
        "peaking",
        "peaking",
        "peaking",
        "peaking",
        "peaking",
        "peaking"
      ]
    },
    "patient-zero-swift": {
      "stage": "peaking",
      "since": "2026-10-11T23:47:16.629612+00:00",
      "ribbon": [
        "peaking",
        "peaking",
        "peaking",
        "peaking",
        "peaking",
        "peaking",
        "peaking",
        "peaking",
        "peaking",
        "peaking",
        "peaking",
        "peaking",
        "peaking",
        "peaking",
        "peaking",
        "peaking",
        "peaking",
        "peaking",
        "peaking",
        "peaking",
        "peaking"
      ]
    },
    "hurricane-isaias": {
      "stage": "peaking",
      "since": "2026-10-11T23:47:16.629612+00:00",
      "ribbon": [
        "peaking",
        "peaking",
        "peaking",
        "peaking",
        "peaking",
        "peaking",
        "peaking",
        "peaking",
        "peaking",
        "peaking",
        "peaking",
        "peaking",
        "peaking",
        "peaking",
        "peaking",
        "peaking",
        "peaking",
        "peaking",
        "peaking",
        "peaking",
        "peaking"
      ]
    },
    "tiktok-sounds-week": {
      "stage": "peaking",
      "since": "2026-10-11T23:47:16.629612+00:00",
      "ribbon": [
        "peaking",
        "peaking",
        "peaking",
        "peaking",
        "peaking",
        "peaking",
        "peaking",
        "peaking",
        "peaking",
        "peaking",
        "peaking",
        "peaking",
        "peaking",
        "peaking",
        "peaking",
        "peaking",
        "peaking",
        "peaking",
        "peaking",
        "peaking",
        "peaking"
      ]
    },
    "pumpkin-head": {
      "stage": "peaking",
      "since": "2026-10-11T23:47:16.629612+00:00",
      "ribbon": [
        "peaking",
        "peaking",
        "peaking",
        "peaking",
        "peaking",
        "peaking",
        "peaking",
        "peaking",
        "peaking",
        "peaking",
        "peaking",
        "peaking",
        "peaking",
        "peaking",
        "peaking",
        "peaking",
        "peaking",
        "peaking",
        "peaking",
        "peaking",
        "peaking"
      ]
    },
    "halloween-game-xbox": {
      "stage": "peaking",
      "since": "2026-10-11T23:47:16.629612+00:00",
      "ribbon": [
        "peaking",
        "peaking",
        "peaking",
        "peaking",
        "peaking",
        "peaking",
        "peaking",
        "peaking",
        "peaking",
        "peaking",
        "peaking",
        "peaking",
        "peaking",
        "peaking",
        "peaking",
        "peaking",
        "peaking",
        "peaking",
        "peaking",
        "peaking",
        "peaking"
      ]
    },
    "grr-mondays": {
      "stage": "peaking",
      "since": "2026-10-11T23:47:16.629612+00:00",
      "ribbon": [
        "peaking",
        "peaking",
        "peaking",
        "peaking",
        "peaking",
        "peaking",
        "peaking",
        "peaking",
        "peaking",
        "peaking",
        "peaking",
        "peaking",
        "peaking",
        "peaking",
        "peaking",
        "peaking",
        "peaking",
        "peaking",
        "peaking",
        "peaking",
        "peaking"
      ]
    },
    "street-fighter-movie": {
      "stage": "peaking",
      "since": "2026-10-11T23:47:16.629612+00:00",
      "ribbon": [
        "peaking",
        "peaking",
        "peaking",
        "peaking",
        "peaking",
        "peaking",
        "peaking",
        "peaking",
        "peaking",
        "peaking",
        "peaking",
        "peaking",
        "peaking",
        "peaking",
        "peaking",
        "peaking",
        "peaking",
        "peaking",
        "peaking",
        "peaking",
        "peaking"
      ]
    },
    "2xko-sett": {
      "stage": "peaking",
      "since": "2026-10-11T23:47:16.629612+00:00",
      "ribbon": [
        "peaking",
        "peaking",
        "peaking",
        "peaking",
        "peaking",
        "peaking",
        "peaking",
        "peaking",
        "peaking",
        "peaking",
        "peaking",
        "peaking",
        "peaking",
        "peaking",
        "peaking",
        "peaking",
        "peaking",
        "peaking",
        "peaking",
        "peaking",
        "peaking"
      ]
    },
    "aion2-launch": {
      "stage": "peaking",
      "since": "2026-10-11T23:47:16.629612+00:00",
      "ribbon": [
        "peaking",
        "peaking",
        "peaking",
        "peaking",
        "peaking",
        "peaking",
        "peaking",
        "peaking",
        "peaking",
        "peaking",
        "peaking",